{
  "schemaVersion": 1,
  "promptVersion": "2026-09-18a",
  "repo": "identity-service",
  "commit": "1e9a394",
  "branch": "main",
  "scannedAt": "2026-09-18T08:07:00Z",
  "producer": {
    "kind": "parser",
    "tool": "seed-demo/1"
  },
  "service": {
    "id": "svc:identity-service",
    "name": "Identity Service",
    "language": "kotlin",
    "team": "identity",
    "description": "Owns the customer record and the KYC lifecycle. Publishes a user event on creation and on KYC approval, and serves the user lookup everything else reads.",
    "tags": [
      "pii"
    ]
  },
  "nodes": [
    {
      "id": "topic:users.created.v2",
      "kind": "kafka.topic",
      "name": "users.created.v2",
      "description": "A customer record has been created. Carries the identity, locale and the signup channel.",
      "evidence": [
        {
          "file": "src/main/kotlin/com/meridian/identity/kafka/Topics.kt",
          "line": 15,
          "snippet": "const val USERS_CREATED = \"users.created.v2\""
        }
      ]
    },
    {
      "id": "topic:kyc.approved.v1",
      "kind": "kafka.topic",
      "name": "kyc.approved.v1",
      "description": "A customer has passed identity verification and may now trade and withdraw.",
      "evidence": [
        {
          "file": "src/main/kotlin/com/meridian/identity/kafka/Topics.kt",
          "line": 26,
          "snippet": "const val KYC_APPROVED = \"kyc.approved.v1\""
        }
      ]
    },
    {
      "id": "db:postgres/identity",
      "kind": "database",
      "name": "identity",
      "engine": "postgres",
      "description": "Customer records, KYC state and credentials.",
      "evidence": [
        {
          "file": "src/main/resources/db/migration/V1__init.sql",
          "line": 1,
          "snippet": "CREATE TABLE customer ("
        }
      ]
    },
    {
      "id": "cache:redis/session",
      "kind": "cache",
      "name": "session",
      "engine": "redis",
      "description": "Customer session tokens, 30 minute sliding TTL.",
      "evidence": [
        {
          "file": "src/main/kotlin/com/meridian/identity/cache/IdentityCache.kt",
          "line": 35,
          "snippet": "redis.opsForValue().set(\"session:$key\", value, Duration.ofMinutes(30))"
        }
      ]
    },
    {
      "id": "api:identity-service/GET /v1/users/{}",
      "kind": "endpoint",
      "name": "GET /v1/users/{}",
      "method": "GET",
      "path": "/v1/users/{}",
      "description": "The customer record by id.",
      "evidence": [
        {
          "file": "src/main/kotlin/com/meridian/identity/api/IdentityController.kt",
          "line": 47,
          "snippet": "@GetMapping(\"/v1/users/{userId}\")"
        }
      ]
    },
    {
      "id": "contract:com.meridian.events.UserCreated",
      "kind": "contract",
      "name": "UserCreated",
      "contractType": "class",
      "version": "3.2.0",
      "description": "Event payload published when a customer record is created.",
      "evidence": [
        {
          "file": "build.gradle.kts",
          "line": 16,
          "snippet": "implementation(\"com.meridian:platform-events:3.2.0\")"
        }
      ]
    }
  ],
  "edges": [
    {
      "from": "svc:identity-service",
      "to": "topic:users.created.v2",
      "kind": "kafka.produce",
      "contract": "contract:com.meridian.events.UserCreated",
      "description": "Announces a new customer so wallets, payment profiles and the welcome mail can follow.",
      "confidence": "medium",
      "evidence": [
        {
          "file": "src/main/kotlin/com/meridian/identity/kafka/IdentityPublisher.kt",
          "line": 21,
          "snippet": "kafka.send(Topics.USERS_CREATED, event.key(), event)"
        }
      ]
    },
    {
      "from": "svc:identity-service",
      "to": "topic:users.created.v2",
      "kind": "topic.schema",
      "contract": "contract:com.meridian.events.UserCreated",
      "description": "UserCreated is the payload on users.created.v2.",
      "confidence": "high",
      "evidence": [
        {
          "file": "src/main/kotlin/com/meridian/identity/kafka/IdentityPublisher.kt",
          "line": 28,
          "snippet": "val event: UserCreated = UserCreated.from(state)"
        }
      ]
    },
    {
      "from": "svc:identity-service",
      "to": "topic:kyc.approved.v1",
      "kind": "kafka.produce",
      "description": "Announces that a customer has passed verification and may now trade.",
      "confidence": "medium",
      "evidence": [
        {
          "file": "src/main/kotlin/com/meridian/identity/kafka/IdentityPublisher.kt",
          "line": 33,
          "snippet": "kafka.send(Topics.KYC_APPROVED, event.key(), event)"
        }
      ]
    },
    {
      "from": "svc:identity-service",
      "to": "db:postgres/identity",
      "kind": "db.owns",
      "description": "Holds the migrations for identity.",
      "confidence": "high",
      "evidence": [
        {
          "file": "src/main/resources/db/migration/V1__init.sql",
          "line": 1,
          "snippet": "CREATE TABLE customer ("
        }
      ]
    },
    {
      "from": "svc:identity-service",
      "to": "db:postgres/identity",
      "kind": "db.write",
      "description": "Writes customer as the owning service.",
      "confidence": "high",
      "evidence": [
        {
          "file": "src/main/kotlin/com/meridian/identity/store/IdentityRepository.kt",
          "line": 6,
          "snippet": "jdbc.update(\"INSERT INTO customer (id, updated_at) VALUES (?, ?)\", id, now)"
        }
      ]
    },
    {
      "from": "svc:identity-service",
      "to": "db:postgres/identity",
      "kind": "db.read",
      "description": "Reads customer to serve its own API.",
      "confidence": "high",
      "evidence": [
        {
          "file": "src/main/kotlin/com/meridian/identity/store/IdentityRepository.kt",
          "line": 17,
          "snippet": "jdbc.query(\"SELECT * FROM customer WHERE id = ?\", rowMapper, id)"
        }
      ]
    },
    {
      "from": "svc:identity-service",
      "to": "cache:redis/session",
      "kind": "cache.read",
      "description": "Issues and revokes the session alongside the credential change.",
      "confidence": "high",
      "evidence": [
        {
          "file": "src/main/kotlin/com/meridian/identity/cache/IdentityCache.kt",
          "line": 46,
          "snippet": "redis.opsForValue().get(\"session:$key\")"
        }
      ]
    },
    {
      "from": "svc:identity-service",
      "to": "cache:redis/session",
      "kind": "cache.write",
      "description": "Issues and revokes the session alongside the credential change.",
      "confidence": "high",
      "evidence": [
        {
          "file": "src/main/kotlin/com/meridian/identity/cache/IdentityCache.kt",
          "line": 35,
          "snippet": "redis.opsForValue().set(\"session:$key\", value, Duration.ofMinutes(30))"
        }
      ]
    },
    {
      "from": "svc:identity-service",
      "to": "api:identity-service/GET /v1/users/{}",
      "kind": "http.expose",
      "description": "The customer record by id.",
      "confidence": "high",
      "evidence": [
        {
          "file": "src/main/kotlin/com/meridian/identity/api/IdentityController.kt",
          "line": 47,
          "snippet": "@GetMapping(\"/v1/users/{userId}\")"
        }
      ]
    },
    {
      "from": "svc:identity-service",
      "to": "contract:com.meridian.events.UserCreated",
      "kind": "depends.on",
      "description": "Binds UserCreated at 3.2.0.",
      "confidence": "high",
      "evidence": [
        {
          "file": "build.gradle.kts",
          "line": 16,
          "snippet": "implementation(\"com.meridian:platform-events:3.2.0\")"
        }
      ]
    }
  ],
  "unresolved": []
}
