{
  "schemaVersion": 1,
  "promptVersion": "2026-09-18a",
  "repo": "pricing-service",
  "commit": "44ba19d",
  "branch": "main",
  "scannedAt": "2026-09-18T08:42:00Z",
  "producer": {
    "kind": "parser",
    "tool": "seed-demo/1"
  },
  "service": {
    "id": "svc:pricing-service",
    "name": "Pricing Service",
    "language": "go",
    "team": "trading",
    "description": "Pulls reference prices from the market data vendor, publishes a tick stream and serves the rate lookup used at order and payment time."
  },
  "nodes": [
    {
      "id": "topic:prices.ticked.v1",
      "kind": "kafka.topic",
      "name": "prices.ticked.v1",
      "description": "Reference price tick per trading pair, emitted on every vendor update.",
      "evidence": [
        {
          "file": "internal/kafka/topics.go",
          "line": 44,
          "snippet": "TopicPricesTicked = \"prices.ticked.v1\""
        }
      ]
    },
    {
      "id": "db:postgres/pricing",
      "kind": "database",
      "name": "pricing",
      "engine": "postgres",
      "description": "Instruments and the reference rate history.",
      "evidence": [
        {
          "file": "migrations/0001_init.sql",
          "line": 1,
          "snippet": "CREATE TABLE rate ("
        }
      ]
    },
    {
      "id": "cache:redis/pricing-quotes",
      "kind": "cache",
      "name": "pricing-quotes",
      "engine": "redis",
      "description": "Last quote per trading pair, 30 second TTL.",
      "evidence": [
        {
          "file": "internal/cache/quotes.go",
          "line": 47,
          "snippet": "rdb.Set(ctx, \"pricing-quotes:\"+symbol, b, 30*time.Second)"
        }
      ]
    },
    {
      "id": "api:pricing-service/GET /v1/rates/{}",
      "kind": "endpoint",
      "name": "GET /v1/rates/{}",
      "method": "GET",
      "path": "/v1/rates/{}",
      "description": "Latest reference rate for one trading pair.",
      "evidence": [
        {
          "file": "internal/api/router.go",
          "line": 25,
          "snippet": "r.Get(\"/v1/rates/{symbol}\", h.Rates)"
        }
      ]
    },
    {
      "id": "ext:coinmarketcap",
      "kind": "external",
      "name": "CoinMarketCap",
      "description": "Market data vendor for reference prices.",
      "evidence": [
        {
          "file": "internal/feed/coinmarketcap.go",
          "line": 9,
          "snippet": "const baseURL = \"https://pro-api.coinmarketcap.com/v1\""
        }
      ]
    }
  ],
  "edges": [
    {
      "from": "svc:pricing-service",
      "to": "topic:prices.ticked.v1",
      "kind": "kafka.produce",
      "description": "Publishes the reference price tick the book and the warehouse run on.",
      "confidence": "medium",
      "evidence": [
        {
          "file": "internal/kafka/publisher.go",
          "line": 8,
          "snippet": "w.WriteMessages(ctx, kafka.Message{Topic: TopicPricesTicked, Value: payload})"
        }
      ]
    },
    {
      "from": "svc:pricing-service",
      "to": "db:postgres/pricing",
      "kind": "db.owns",
      "description": "Holds the migrations for pricing.",
      "confidence": "high",
      "evidence": [
        {
          "file": "migrations/0001_init.sql",
          "line": 1,
          "snippet": "CREATE TABLE rate ("
        }
      ]
    },
    {
      "from": "svc:pricing-service",
      "to": "db:postgres/pricing",
      "kind": "db.write",
      "description": "Writes rate as the owning service.",
      "confidence": "high",
      "evidence": [
        {
          "file": "internal/store/postgres.go",
          "line": 34,
          "snippet": "_, err := s.db.ExecContext(ctx, `INSERT INTO rate (symbol, price, at) VALUES ($1, $2, $3)`, sym, px, at)"
        }
      ]
    },
    {
      "from": "svc:pricing-service",
      "to": "db:postgres/pricing",
      "kind": "db.read",
      "description": "Reads rate to serve its own API.",
      "confidence": "high",
      "evidence": [
        {
          "file": "internal/store/postgres.go",
          "line": 43,
          "snippet": "row := s.db.QueryRowContext(ctx, `SELECT price FROM rate WHERE symbol = $1 ORDER BY at DESC LIMIT 1`, sym)"
        }
      ]
    },
    {
      "from": "svc:pricing-service",
      "to": "cache:redis/pricing-quotes",
      "kind": "cache.write",
      "description": "Caches each tick so the rate lookup does not hit the database.",
      "confidence": "high",
      "evidence": [
        {
          "file": "internal/cache/quotes.go",
          "line": 47,
          "snippet": "rdb.Set(ctx, \"pricing-quotes:\"+symbol, b, 30*time.Second)"
        }
      ]
    },
    {
      "from": "svc:pricing-service",
      "to": "api:pricing-service/GET /v1/rates/{}",
      "kind": "http.expose",
      "description": "Latest reference rate for one trading pair.",
      "confidence": "high",
      "evidence": [
        {
          "file": "internal/api/router.go",
          "line": 25,
          "snippet": "r.Get(\"/v1/rates/{symbol}\", h.Rates)"
        }
      ]
    },
    {
      "from": "svc:pricing-service",
      "to": "ext:coinmarketcap",
      "kind": "http.call",
      "description": "Polls the vendor for the reference prices the tick stream is built from.",
      "confidence": "high",
      "evidence": [
        {
          "file": "internal/feed/coinmarketcap.go",
          "line": 9,
          "snippet": "const baseURL = \"https://pro-api.coinmarketcap.com/v1\""
        }
      ]
    }
  ],
  "unresolved": []
}
