{
  "schemaVersion": 1,
  "promptVersion": "2026-09-18a",
  "repo": "notification-service",
  "commit": "81034a8",
  "branch": "main",
  "scannedAt": "2026-09-18T08:56:00Z",
  "producer": {
    "kind": "parser",
    "tool": "seed-demo/1"
  },
  "service": {
    "id": "svc:notification-service",
    "name": "Notification Service",
    "language": "typescript",
    "team": "growth",
    "description": "Turns platform events into customer email and push. Subscribes to the events it can act on and consumes an explicit request topic for everything else."
  },
  "nodes": [
    {
      "id": "topic:users.created.v2",
      "kind": "kafka.topic",
      "name": "users.created.v2",
      "description": "A customer record has been created. Carries the identity, locale and the signup channel.",
      "evidence": [
        {
          "file": "src/kafka/topics.ts",
          "line": 22,
          "snippet": "export const USERS_CREATED = 'users.created.v2'"
        }
      ]
    },
    {
      "id": "topic:wallet.balance.changed.v1",
      "kind": "kafka.topic",
      "name": "wallet.balance.changed.v1",
      "description": "A balance moved, with the asset, the delta and the reason it moved.",
      "evidence": [
        {
          "file": "src/kafka/topics.ts",
          "line": 25,
          "snippet": "export const WALLET_BALANCE_CHANGED = 'wallet.balance.changed.v1'"
        }
      ]
    },
    {
      "id": "topic:notifications.requested.v1",
      "kind": "kafka.topic",
      "name": "notifications.requested.v1",
      "description": "An explicit request to notify a customer, for the cases no domain event covers.",
      "evidence": [
        {
          "file": "src/kafka/topics.ts",
          "line": 40,
          "snippet": "export const NOTIFICATIONS_REQUESTED = 'notifications.requested.v1'"
        }
      ]
    },
    {
      "id": "contract:com.meridian.events.UserCreated",
      "kind": "contract",
      "name": "UserCreated",
      "contractType": "class",
      "version": "3.0.0",
      "description": "Event payload published when a customer record is created.",
      "evidence": [
        {
          "file": "package.json",
          "line": 47,
          "snippet": "\"@meridian/platform-events\": \"3.0.0\","
        }
      ]
    },
    {
      "id": "contract:com.meridian.events.BalanceChanged",
      "kind": "contract",
      "name": "BalanceChanged",
      "contractType": "class",
      "version": "3.0.0",
      "description": "Event payload for a balance movement on one asset.",
      "evidence": [
        {
          "file": "package.json",
          "line": 47,
          "snippet": "\"@meridian/platform-events\": \"3.0.0\","
        }
      ]
    },
    {
      "id": "ext:sendgrid",
      "kind": "external",
      "name": "SendGrid",
      "description": "Transactional email provider.",
      "evidence": [
        {
          "file": "src/providers/sendgrid.ts",
          "line": 8,
          "snippet": "const baseUrl = 'https://api.sendgrid.com/v3'"
        }
      ]
    }
  ],
  "edges": [
    {
      "from": "svc:notification-service",
      "to": "topic:users.created.v2",
      "kind": "kafka.consume",
      "contract": "contract:com.meridian.events.UserCreated",
      "description": "Sends the welcome mail.",
      "confidence": "medium",
      "evidence": [
        {
          "file": "src/kafka/consumers/usersCreated.ts",
          "line": 48,
          "snippet": "await consumer.subscribe({ topic: USERS_CREATED, fromBeginning: false })"
        }
      ]
    },
    {
      "from": "svc:notification-service",
      "to": "topic:wallet.balance.changed.v1",
      "kind": "kafka.consume",
      "contract": "contract:com.meridian.events.BalanceChanged",
      "description": "Tells the customer their balance moved.",
      "confidence": "medium",
      "evidence": [
        {
          "file": "src/kafka/consumers/walletBalanceChanged.ts",
          "line": 7,
          "snippet": "await consumer.subscribe({ topic: WALLET_BALANCE_CHANGED, fromBeginning: false })"
        }
      ]
    },
    {
      "from": "svc:notification-service",
      "to": "topic:notifications.requested.v1",
      "kind": "kafka.consume",
      "description": "Renders and sends whatever the requesting service asked for.",
      "confidence": "medium",
      "evidence": [
        {
          "file": "src/kafka/consumers/notificationsRequested.ts",
          "line": 20,
          "snippet": "await consumer.subscribe({ topic: NOTIFICATIONS_REQUESTED, fromBeginning: false })"
        }
      ]
    },
    {
      "from": "svc:notification-service",
      "to": "contract:com.meridian.events.UserCreated",
      "kind": "depends.on",
      "description": "Binds UserCreated at 3.0.0.",
      "confidence": "high",
      "evidence": [
        {
          "file": "package.json",
          "line": 47,
          "snippet": "\"@meridian/platform-events\": \"3.0.0\","
        }
      ]
    },
    {
      "from": "svc:notification-service",
      "to": "contract:com.meridian.events.BalanceChanged",
      "kind": "depends.on",
      "description": "Binds BalanceChanged at 3.0.0.",
      "confidence": "high",
      "evidence": [
        {
          "file": "package.json",
          "line": 47,
          "snippet": "\"@meridian/platform-events\": \"3.0.0\","
        }
      ]
    },
    {
      "from": "svc:notification-service",
      "to": "ext:sendgrid",
      "kind": "http.call",
      "description": "Delivers the customer email once a template has been rendered.",
      "confidence": "high",
      "evidence": [
        {
          "file": "src/providers/sendgrid.ts",
          "line": 8,
          "snippet": "const baseUrl = 'https://api.sendgrid.com/v3'"
        }
      ]
    }
  ],
  "unresolved": [
    {
      "expected": "endpoint",
      "raw": "process.env.TEMPLATE_SERVICE_URL",
      "reason": "The template service base URL comes from an environment variable that is set outside the repository.",
      "evidence": [
        {
          "file": "src/providers/templates.ts",
          "line": 25,
          "snippet": "const base = process.env.TEMPLATE_SERVICE_URL ?? throwMissing('TEMPLATE_SERVICE_URL')"
        }
      ]
    }
  ]
}
